{
  "tool": { "name": "limited-target", "version": "1.0.0" },
  "export": { "profiles": ["content-only"], "mediaTypes": ["application/vnd.sitepack.entity-graph+ndjson"] },
  "import": { "profiles": ["content-only"], "mediaTypes": ["application/vnd.sitepack.entity-graph+ndjson"] },
  "mapping": {
    "semanticProfiles": [{ "id": "example.portable-target", "versions": ["1.0.0"] }],
    "entities": {
      "page": { "fields": ["title", "body"], "relations": [], "assets": ["media"] }
    },
    "contentFormats": ["html"],
    "assetStorage": ["embedded"],
    "transforms": [],
    "extensions": []
  }
}
